{
  "$schema": "https://json-schema.org/draft/2020-12/schema",
  "title": "Canción Compás a compás, versión 1",
  "type": "object",
  "properties": {
    "schemaVersion": {
      "const": 1
    },
    "documentVersion": {
      "type": "string"
    },
    "title": {
      "type": "string"
    },
    "key": {
      "type": "string"
    },
    "keyFamily": {
      "$ref": "#/$defs/family"
    },
    "showTonalities": {
      "type": "boolean"
    },
    "measures": {
      "type": "array",
      "items": {
        "$ref": "#/$defs/measure"
      },
      "minItems": 0
    },
    "structure": {
      "$ref": "#/$defs/structure"
    },
    "palette": {
      "$ref": "#/$defs/palette"
    },
    "showMeasureNumbers": {
      "type": "boolean",
      "description": "Ausente = true. Solo false oculta las etiquetas de compás en la hoja; no las borra."
    },
    "renumberMeasures": {
      "type": "boolean",
      "description": "Ausente = true: insertar, pegar, duplicar, borrar o mover compases renumera las etiquetas numéricas en orden escrito. false conserva las etiquetas originales."
    },
    "maxMeasuresPerRow": {
      "type": "integer",
      "minimum": 1,
      "maximum": 16,
      "description": "Tope de compases por línea. Ausente = modo automático."
    },
    "fretboardScalePercent": {
      "type": "integer",
      "minimum": 60,
      "maximum": 100,
      "description": "Escala uniforme de los mástiles en las tarjetas. Ausente o 100 = tamaño normal."
    }
  },
  "required": [
    "schemaVersion",
    "title",
    "key",
    "measures",
    "structure"
  ],
  "additionalProperties": false,
  "$defs": {
    "family": {
      "enum": [
        "major",
        "minor",
        "dominant",
        "half-diminished",
        "diminished",
        "other"
      ]
    },
    "tonality": {
      "type": "object",
      "properties": {
        "text": {
          "type": "string",
          "pattern": "\\S"
        },
        "family": {
          "$ref": "#/$defs/family"
        }
      },
      "required": [
        "text",
        "family"
      ],
      "additionalProperties": false
    },
    "voicing": {
      "type": "object",
      "properties": {
        "id": {
          "type": "string",
          "minLength": 1
        },
        "frets": {
          "type": "array",
          "minItems": 6,
          "maxItems": 6,
          "items": {
            "type": [
              "integer",
              "null"
            ],
            "minimum": 0
          }
        },
        "degrees": {
          "type": "array",
          "minItems": 6,
          "maxItems": 6,
          "items": {
            "type": [
              "string",
              "null"
            ]
          }
        },
        "aboveText": {
          "type": "string"
        },
        "insideText": {
          "type": "string"
        },
        "voicingDegree": {
          "type": "string",
          "pattern": "\\S"
        },
        "anchorFret": {
          "type": "integer",
          "minimum": 1,
          "description": "Traste de referencia: resalta esa columna del mástil y la incluye en el rango visible."
        },
        "tonality": {
          "$ref": "#/$defs/tonality"
        }
      },
      "required": [
        "id",
        "frets"
      ],
      "additionalProperties": false
    },
    "chordEvent": {
      "type": "object",
      "properties": {
        "id": {
          "type": "string",
          "minLength": 1
        },
        "chordName": {
          "type": "string",
          "description": "Puede estar vacío: una tarjeta nueva no lleva nombre de prueba y la hoja no dibuja nada en su lugar."
        },
        "aboveText": {
          "type": "string"
        },
        "insideText": {
          "type": "string"
        },
        "family": {
          "enum": [
            "major",
            "minor",
            "dominant",
            "half-diminished",
            "diminished",
            "other"
          ]
        },
        "voicings": {
          "type": "array",
          "items": {
            "$ref": "#/$defs/voicing"
          },
          "minItems": 0
        }
      },
      "required": [
        "id",
        "chordName",
        "voicings"
      ],
      "additionalProperties": false
    },
    "measure": {
      "type": "object",
      "properties": {
        "id": {
          "type": "string",
          "minLength": 1
        },
        "label": {
          "type": "string",
          "minLength": 1
        },
        "chordEvents": {
          "type": "array",
          "items": {
            "$ref": "#/$defs/chordEvent"
          },
          "minItems": 0
        },
        "repeatPrevious": {
          "$ref": "#/$defs/repeatPrevious"
        },
        "repeatPreviousTwo": {
          "$ref": "#/$defs/repeatPreviousTwo"
        },
        "widthPercent": {
          "type": "integer",
          "minimum": 10,
          "maximum": 100,
          "description": "Ancho manual del compás como porcentaje del ancho útil de la línea. Ausente = ancho automático. Nunca baja del ancho mínimo de sus tarjetas."
        },
        "fillToEdge": {
          "type": "boolean",
          "description": "Ajustar la línea de este compás al margen derecho (solo se guarda true; ausente = automático). Una línea se ajusta si alguno de sus compases lo lleva."
        }
      },
      "required": [
        "id",
        "label",
        "chordEvents"
      ],
      "additionalProperties": false,
      "allOf": [
        {
          "if": {
            "anyOf": [
              {
                "required": [
                  "repeatPrevious"
                ]
              },
              {
                "required": [
                  "repeatPreviousTwo"
                ]
              }
            ]
          },
          "then": {
            "properties": {
              "chordEvents": {
                "maxItems": 0
              }
            }
          }
        },
        {
          "not": {
            "required": [
              "repeatPrevious",
              "repeatPreviousTwo"
            ]
          }
        }
      ]
    },
    "repeat": {
      "type": "object",
      "properties": {
        "id": {
          "type": "string",
          "minLength": 1
        },
        "startMeasureId": {
          "type": "string",
          "minLength": 1
        },
        "endMeasureId": {
          "type": "string",
          "minLength": 1
        },
        "times": {
          "type": "integer",
          "minimum": 2
        }
      },
      "required": [
        "id",
        "startMeasureId",
        "endMeasureId",
        "times"
      ],
      "additionalProperties": false
    },
    "ending": {
      "type": "object",
      "properties": {
        "id": {
          "type": "string",
          "minLength": 1
        },
        "startMeasureId": {
          "type": "string",
          "minLength": 1
        },
        "endMeasureId": {
          "type": "string",
          "minLength": 1
        },
        "passes": {
          "type": "array",
          "items": {
            "type": "integer",
            "minimum": 1
          },
          "minItems": 1,
          "uniqueItems": true
        },
        "repeatId": {
          "type": "string",
          "minLength": 1
        }
      },
      "required": [
        "id",
        "startMeasureId",
        "endMeasureId",
        "passes"
      ],
      "additionalProperties": false
    },
    "marker": {
      "type": "object",
      "properties": {
        "id": {
          "type": "string",
          "minLength": 1
        },
        "type": {
          "enum": [
            "segno",
            "coda",
            "fine"
          ]
        },
        "measureId": {
          "type": "string",
          "minLength": 1
        },
        "edge": {
          "enum": [
            "before",
            "after"
          ]
        }
      },
      "required": [
        "id",
        "type",
        "measureId",
        "edge"
      ],
      "additionalProperties": false
    },
    "jump": {
      "type": "object",
      "properties": {
        "id": {
          "type": "string",
          "minLength": 1
        },
        "type": {
          "enum": [
            "dc",
            "ds",
            "dc-al-coda",
            "ds-al-coda",
            "dc-al-fine",
            "ds-al-fine",
            "to-coda"
          ]
        },
        "measureId": {
          "type": "string",
          "minLength": 1
        },
        "edge": {
          "enum": [
            "before",
            "after"
          ]
        },
        "segnoMarkerId": {
          "type": "string",
          "minLength": 1
        },
        "codaMarkerId": {
          "type": "string",
          "minLength": 1
        },
        "fineMarkerId": {
          "type": "string",
          "minLength": 1
        }
      },
      "required": [
        "id",
        "type",
        "measureId",
        "edge"
      ],
      "additionalProperties": false
    },
    "structure": {
      "type": "object",
      "properties": {
        "repeats": {
          "type": "array",
          "items": {
            "$ref": "#/$defs/repeat"
          },
          "minItems": 0
        },
        "endings": {
          "type": "array",
          "items": {
            "$ref": "#/$defs/ending"
          },
          "minItems": 0
        },
        "markers": {
          "type": "array",
          "items": {
            "$ref": "#/$defs/marker"
          },
          "minItems": 0
        },
        "jumps": {
          "type": "array",
          "items": {
            "$ref": "#/$defs/jump"
          },
          "minItems": 0
        }
      },
      "required": [
        "repeats",
        "endings",
        "markers",
        "jumps"
      ],
      "additionalProperties": false
    },
    "palette": {
      "type": "object",
      "additionalProperties": false,
      "properties": {
        "families": {
          "type": "object",
          "additionalProperties": false,
          "properties": {
            "major": {
              "type": "string",
              "pattern": "^#[0-9a-fA-F]{6}$",
              "minLength": 7,
              "maxLength": 7
            },
            "minor": {
              "type": "string",
              "pattern": "^#[0-9a-fA-F]{6}$",
              "minLength": 7,
              "maxLength": 7
            },
            "dominant": {
              "type": "string",
              "pattern": "^#[0-9a-fA-F]{6}$",
              "minLength": 7,
              "maxLength": 7
            },
            "half-diminished": {
              "type": "string",
              "pattern": "^#[0-9a-fA-F]{6}$",
              "minLength": 7,
              "maxLength": 7
            },
            "diminished": {
              "type": "string",
              "pattern": "^#[0-9a-fA-F]{6}$",
              "minLength": 7,
              "maxLength": 7
            },
            "other": {
              "type": "string",
              "pattern": "^#[0-9a-fA-F]{6}$",
              "minLength": 7,
              "maxLength": 7
            }
          }
        },
        "degrees": {
          "type": "object",
          "propertyNames": {
            "minLength": 1,
            "maxLength": 32,
            "not": {
              "enum": [
                "__proto__",
                "constructor",
                "prototype"
              ]
            }
          },
          "additionalProperties": {
            "type": "string",
            "pattern": "^#[0-9a-fA-F]{6}$",
            "minLength": 7,
            "maxLength": 7
          }
        },
        "degreeText": {
          "type": "object",
          "propertyNames": {
            "minLength": 1,
            "maxLength": 32,
            "not": {
              "enum": [
                "__proto__",
                "constructor",
                "prototype"
              ]
            }
          },
          "additionalProperties": {
            "type": "string",
            "pattern": "^#[0-9a-fA-F]{6}$",
            "minLength": 7,
            "maxLength": 7
          }
        },
        "note": {
          "type": "string",
          "pattern": "^#[0-9a-fA-F]{6}$",
          "minLength": 7,
          "maxLength": 7
        },
        "noteText": {
          "type": "string",
          "pattern": "^#[0-9a-fA-F]{6}$",
          "minLength": 7,
          "maxLength": 7
        }
      }
    },
    "repeatPrevious": {
      "type": "object",
      "description": "El compás repite el compás inmediatamente anterior en el orden escrito (signo de repetición de un compás). No copia tarjetas ni voicings; un compás así no tiene chordEvents. La referencia se conserva si el origen se borra o se mueve y la aplicación avisa.",
      "properties": {
        "sourceMeasureId": {
          "type": "string",
          "minLength": 1
        }
      },
      "required": [
        "sourceMeasureId"
      ],
      "additionalProperties": false
    },
    "repeatPreviousTwo": {
      "type": "object",
      "description": "Marca en el primer compás de destino: la pareja de destino (targetMeasureIds, consecutivos, el primero es este compás) repite como pareja los dos compases inmediatamente anteriores (sourceMeasureIds, en orden). Sin tarjetas propias en los destinos. Si un compás se borra o se mueve, los IDs se conservan y la aplicación avisa.",
      "properties": {
        "sourceMeasureIds": {
          "type": "array",
          "items": {
            "type": "string",
            "minLength": 1
          },
          "minItems": 2,
          "maxItems": 2,
          "uniqueItems": true
        },
        "targetMeasureIds": {
          "type": "array",
          "items": {
            "type": "string",
            "minLength": 1
          },
          "minItems": 2,
          "maxItems": 2,
          "uniqueItems": true
        }
      },
      "required": [
        "sourceMeasureIds",
        "targetMeasureIds"
      ],
      "additionalProperties": false
    }
  }
}
