{
  "schemaVersion": 1,
  "documentVersion": "1.0",
  "title": "Nombre del tema",
  "key": "Tonalidad",
  "keyFamily": "major",
  "showTonalities": false,
  "measures": [
    {
      "id": "m1",
      "label": "1",
      "chordEvents": [
        {
          "id": "e1",
          "chordName": "Dm7",
          "family": "minor",
          "voicings": [
            {
              "id": "v1",
              "frets": [
                null,
                null,
                7,
                7,
                6,
                8
              ],
              "degrees": [
                null,
                null,
                "5",
                "1",
                "b3",
                "b7"
              ],
              "insideText": "Drop 2 Set 1 · 2ª inversión"
            }
          ]
        },
        {
          "id": "e2",
          "chordName": "G7",
          "family": "dominant",
          "voicings": [
            {
              "id": "v2",
              "frets": [
                null,
                null,
                5,
                7,
                6,
                7
              ],
              "degrees": [
                null,
                null,
                "1",
                "5",
                "b7",
                "3"
              ],
              "insideText": "Drop 2 Set 1 · Fundamental"
            }
          ]
        }
      ]
    },
    {
      "id": "m2",
      "label": "2",
      "chordEvents": [
        {
          "id": "e3",
          "chordName": "Cmaj7",
          "family": "major",
          "voicings": [
            {
              "id": "v3",
              "frets": [
                null,
                null,
                5,
                5,
                5,
                7
              ],
              "degrees": [
                null,
                null,
                "5",
                "1",
                "3",
                "7"
              ],
              "insideText": "Drop 2 Set 1 · 2ª inversión"
            }
          ]
        }
      ]
    },
    {
      "id": "m3",
      "label": "3",
      "chordEvents": [
        {
          "id": "e4",
          "chordName": "Dm7",
          "family": "minor",
          "voicings": [
            {
              "id": "v4",
              "frets": [
                null,
                null,
                3,
                5,
                3,
                5
              ],
              "degrees": [
                null,
                null,
                "b3",
                "b7",
                "1",
                "5"
              ],
              "insideText": "Drop 2 Set 1 · 1ª inversión"
            }
          ]
        },
        {
          "id": "e5",
          "chordName": "G7",
          "family": "dominant",
          "voicings": [
            {
              "id": "v5",
              "frets": [
                null,
                null,
                3,
                4,
                3,
                3
              ],
              "degrees": [
                null,
                null,
                "b7",
                "3",
                "5",
                "1"
              ],
              "insideText": "Drop 2 Set 1 · 3ª inversión"
            }
          ]
        }
      ]
    },
    {
      "id": "m4",
      "label": "4",
      "chordEvents": [
        {
          "id": "e6",
          "chordName": "Cmaj7",
          "family": "major",
          "voicings": [
            {
              "id": "v6",
              "frets": [
                null,
                null,
                2,
                4,
                1,
                3
              ],
              "degrees": [
                null,
                null,
                "3",
                "7",
                "1",
                "5"
              ],
              "insideText": "Drop 2 Set 1 · 1ª inversión"
            }
          ]
        }
      ]
    }
  ],
  "structure": {
    "repeats": [],
    "endings": [],
    "markers": [],
    "jumps": []
  }
}
