{
  "schemaVersion": 1,
  "documentVersion": "1.0",
  "title": "Rutas II–V–I menores · Drop 2 · Set 1",
  "key": "C menor",
  "keyFamily": "minor",
  "showTonalities": false,
  "showMeasureNumbers": false,
  "maxMeasuresPerRow": 3,
  "measures": [
    {
      "id": "m-minor-s1-r1-1",
      "label": "Ruta 1 · iiø",
      "chordEvents": [
        {
          "id": "e-minor-s1-r1-1",
          "chordName": "Dm7(b5)",
          "family": "half-diminished",
          "voicings": [
            {
              "id": "v-minor-s1-r1-1",
              "frets": [
                null,
                null,
                12,
                13,
                13,
                13
              ],
              "degrees": [
                null,
                null,
                "1",
                "b5",
                "b7",
                "b3"
              ],
              "aboveText": "",
              "voicingDegree": "Fundamental",
              "anchorFret": 12
            }
          ]
        }
      ],
      "fillToEdge": true
    },
    {
      "id": "m-minor-s1-r1-2",
      "label": "Ruta 1 · V",
      "chordEvents": [
        {
          "id": "e-minor-s1-r1-2",
          "chordName": "G7",
          "family": "dominant",
          "voicings": [
            {
              "id": "v-minor-s1-r1-2",
              "frets": [
                null,
                null,
                12,
                12,
                12,
                13
              ],
              "degrees": [
                null,
                null,
                "5",
                "1",
                "3",
                "b7"
              ],
              "aboveText": "",
              "voicingDegree": "2ª Inversión",
              "anchorFret": 12
            }
          ]
        }
      ],
      "fillToEdge": true
    },
    {
      "id": "m-minor-s1-r1-3",
      "label": "Ruta 1 · i",
      "chordEvents": [
        {
          "id": "e-minor-s1-r1-3",
          "chordName": "Cm7",
          "family": "minor",
          "voicings": [
            {
              "id": "v-minor-s1-r1-3",
              "frets": [
                null,
                null,
                10,
                12,
                11,
                11
              ],
              "degrees": [
                null,
                null,
                "1",
                "5",
                "b7",
                "b3"
              ],
              "aboveText": "",
              "voicingDegree": "Fundamental",
              "anchorFret": 12
            }
          ]
        }
      ],
      "fillToEdge": true
    },
    {
      "id": "m-minor-s1-r2-1",
      "label": "Ruta 2 · iiø",
      "chordEvents": [
        {
          "id": "e-minor-s1-r2-1",
          "chordName": "Dm7(b5)",
          "family": "half-diminished",
          "voicings": [
            {
              "id": "v-minor-s1-r2-1",
              "frets": [
                null,
                null,
                3,
                5,
                3,
                4
              ],
              "degrees": [
                null,
                null,
                "b3",
                "b7",
                "1",
                "b5"
              ],
              "aboveText": "",
              "voicingDegree": "1ª Inversión",
              "anchorFret": 3
            }
          ]
        }
      ],
      "fillToEdge": true
    },
    {
      "id": "m-minor-s1-r2-2",
      "label": "Ruta 2 · V",
      "chordEvents": [
        {
          "id": "e-minor-s1-r2-2",
          "chordName": "G7",
          "family": "dominant",
          "voicings": [
            {
              "id": "v-minor-s1-r2-2",
              "frets": [
                null,
                null,
                3,
                4,
                3,
                3
              ],
              "degrees": [
                null,
                null,
                "b7",
                "3",
                "5",
                "1"
              ],
              "aboveText": "",
              "voicingDegree": "3ª Inversión",
              "anchorFret": 3
            }
          ]
        }
      ],
      "fillToEdge": true
    },
    {
      "id": "m-minor-s1-r2-3",
      "label": "Ruta 2 · i",
      "chordEvents": [
        {
          "id": "e-minor-s1-r2-3",
          "chordName": "Cm7",
          "family": "minor",
          "voicings": [
            {
              "id": "v-minor-s1-r2-3",
              "frets": [
                null,
                null,
                1,
                3,
                1,
                3
              ],
              "degrees": [
                null,
                null,
                "b3",
                "b7",
                "1",
                "5"
              ],
              "aboveText": "",
              "voicingDegree": "1ª Inversión",
              "anchorFret": 3
            }
          ]
        }
      ],
      "fillToEdge": true
    },
    {
      "id": "m-minor-s1-r3-1",
      "label": "Ruta 3 · iiø",
      "chordEvents": [
        {
          "id": "e-minor-s1-r3-1",
          "chordName": "Dm7(b5)",
          "family": "half-diminished",
          "voicings": [
            {
              "id": "v-minor-s1-r3-1",
              "frets": [
                null,
                null,
                6,
                7,
                6,
                8
              ],
              "degrees": [
                null,
                null,
                "b5",
                "1",
                "b3",
                "b7"
              ],
              "aboveText": "",
              "voicingDegree": "2ª Inversión",
              "anchorFret": 7
            }
          ]
        }
      ],
      "fillToEdge": true
    },
    {
      "id": "m-minor-s1-r3-2",
      "label": "Ruta 3 · V",
      "chordEvents": [
        {
          "id": "e-minor-s1-r3-2",
          "chordName": "G7",
          "family": "dominant",
          "voicings": [
            {
              "id": "v-minor-s1-r3-2",
              "frets": [
                null,
                null,
                5,
                7,
                6,
                7
              ],
              "degrees": [
                null,
                null,
                "1",
                "5",
                "b7",
                "3"
              ],
              "aboveText": "",
              "voicingDegree": "Fundamental",
              "anchorFret": 7
            }
          ]
        }
      ],
      "fillToEdge": true
    },
    {
      "id": "m-minor-s1-r3-3",
      "label": "Ruta 3 · i",
      "chordEvents": [
        {
          "id": "e-minor-s1-r3-3",
          "chordName": "Cm7",
          "family": "minor",
          "voicings": [
            {
              "id": "v-minor-s1-r3-3",
              "frets": [
                null,
                null,
                5,
                5,
                4,
                6
              ],
              "degrees": [
                null,
                null,
                "5",
                "1",
                "b3",
                "b7"
              ],
              "aboveText": "",
              "voicingDegree": "2ª Inversión",
              "anchorFret": 7
            }
          ]
        }
      ],
      "fillToEdge": true
    },
    {
      "id": "m-minor-s1-r4-1",
      "label": "Ruta 4 · iiø",
      "chordEvents": [
        {
          "id": "e-minor-s1-r4-1",
          "chordName": "Dm7(b5)",
          "family": "half-diminished",
          "voicings": [
            {
              "id": "v-minor-s1-r4-1",
              "frets": [
                null,
                null,
                10,
                10,
                9,
                10
              ],
              "degrees": [
                null,
                null,
                "b7",
                "b3",
                "b5",
                "1"
              ],
              "aboveText": "",
              "voicingDegree": "3ª Inversión",
              "anchorFret": 10
            }
          ]
        }
      ],
      "fillToEdge": true
    },
    {
      "id": "m-minor-s1-r4-2",
      "label": "Ruta 4 · V",
      "chordEvents": [
        {
          "id": "e-minor-s1-r4-2",
          "chordName": "G7",
          "family": "dominant",
          "voicings": [
            {
              "id": "v-minor-s1-r4-2",
              "frets": [
                null,
                null,
                9,
                10,
                8,
                10
              ],
              "degrees": [
                null,
                null,
                "3",
                "b7",
                "1",
                "5"
              ],
              "aboveText": "",
              "voicingDegree": "1ª Inversión",
              "anchorFret": 10
            }
          ]
        }
      ],
      "fillToEdge": true
    },
    {
      "id": "m-minor-s1-r4-3",
      "label": "Ruta 4 · i",
      "chordEvents": [
        {
          "id": "e-minor-s1-r4-3",
          "chordName": "Cm7",
          "family": "minor",
          "voicings": [
            {
              "id": "v-minor-s1-r4-3",
              "frets": [
                null,
                null,
                8,
                8,
                8,
                8
              ],
              "degrees": [
                null,
                null,
                "b7",
                "b3",
                "5",
                "1"
              ],
              "aboveText": "",
              "voicingDegree": "3ª Inversión",
              "anchorFret": 10
            }
          ]
        }
      ],
      "fillToEdge": true
    }
  ],
  "structure": {
    "repeats": [],
    "endings": [],
    "markers": [],
    "jumps": []
  },
  "fretboardScalePercent": 94
}
