{
  "schemaVersion": 1,
  "documentVersion": "1.0",
  "title": "Rutas II–V–I mayores · Drop 2 · Set 2",
  "key": "C mayor",
  "keyFamily": "major",
  "showTonalities": false,
  "showMeasureNumbers": false,
  "maxMeasuresPerRow": 4,
  "measures": [
    {
      "id": "m-major-s2-r1-1",
      "label": "Ruta 1 · ii",
      "chordEvents": [
        {
          "id": "e-major-s2-r1-1",
          "chordName": "Dm7",
          "family": "minor",
          "voicings": [
            {
              "id": "v-major-s2-r1-1",
              "frets": [
                null,
                5,
                7,
                5,
                6,
                null
              ],
              "degrees": [
                null,
                "1",
                "5",
                "b7",
                "b3",
                null
              ],
              "aboveText": "",
              "voicingDegree": "Fundamental",
              "anchorFret": 5
            }
          ]
        }
      ],
      "fillToEdge": true
    },
    {
      "id": "m-major-s2-r1-2",
      "label": "Ruta 1 · V",
      "chordEvents": [
        {
          "id": "e-major-s2-r1-2",
          "chordName": "G7",
          "family": "dominant",
          "voicings": [
            {
              "id": "v-major-s2-r1-2",
              "frets": [
                null,
                5,
                5,
                4,
                6,
                null
              ],
              "degrees": [
                null,
                "5",
                "1",
                "3",
                "b7",
                null
              ],
              "aboveText": "",
              "voicingDegree": "2ª Inversión",
              "anchorFret": 5
            }
          ]
        }
      ],
      "fillToEdge": true
    },
    {
      "id": "m-major-s2-r1-3",
      "label": "Ruta 1 · I",
      "chordEvents": [
        {
          "id": "e-major-s2-r1-3",
          "chordName": "Cmaj7",
          "family": "major",
          "voicings": [
            {
              "id": "v-major-s2-r1-3",
              "frets": [
                null,
                3,
                5,
                4,
                5,
                null
              ],
              "degrees": [
                null,
                "1",
                "5",
                "7",
                "3",
                null
              ],
              "aboveText": "",
              "voicingDegree": "Fundamental",
              "anchorFret": 5
            }
          ]
        }
      ],
      "fillToEdge": true
    },
    {
      "id": "m-major-s2-r2-1",
      "label": "Ruta 2 · ii",
      "chordEvents": [
        {
          "id": "e-major-s2-r2-1",
          "chordName": "Dm7",
          "family": "minor",
          "voicings": [
            {
              "id": "v-major-s2-r2-1",
              "frets": [
                null,
                8,
                10,
                7,
                10,
                null
              ],
              "degrees": [
                null,
                "b3",
                "b7",
                "1",
                "5",
                null
              ],
              "aboveText": "",
              "voicingDegree": "1ª Inversión",
              "anchorFret": 7
            }
          ]
        }
      ],
      "fillToEdge": true
    },
    {
      "id": "m-major-s2-r2-2",
      "label": "Ruta 2 · V",
      "chordEvents": [
        {
          "id": "e-major-s2-r2-2",
          "chordName": "G7",
          "family": "dominant",
          "voicings": [
            {
              "id": "v-major-s2-r2-2",
              "frets": [
                null,
                8,
                9,
                7,
                8,
                null
              ],
              "degrees": [
                null,
                "b7",
                "3",
                "5",
                "1",
                null
              ],
              "aboveText": "",
              "voicingDegree": "3ª Inversión",
              "anchorFret": 7
            }
          ]
        }
      ],
      "fillToEdge": true
    },
    {
      "id": "m-major-s2-r2-3",
      "label": "Ruta 2 · I",
      "chordEvents": [
        {
          "id": "e-major-s2-r2-3",
          "chordName": "Cmaj7",
          "family": "major",
          "voicings": [
            {
              "id": "v-major-s2-r2-3",
              "frets": [
                null,
                7,
                9,
                5,
                8,
                null
              ],
              "degrees": [
                null,
                "3",
                "7",
                "1",
                "5",
                null
              ],
              "aboveText": "",
              "voicingDegree": "1ª Inversión",
              "anchorFret": 7
            }
          ]
        }
      ],
      "fillToEdge": true
    },
    {
      "id": "m-major-s2-r3-1",
      "label": "Ruta 3 · ii",
      "chordEvents": [
        {
          "id": "e-major-s2-r3-1",
          "chordName": "Dm7",
          "family": "minor",
          "voicings": [
            {
              "id": "v-major-s2-r3-1",
              "frets": [
                null,
                12,
                12,
                10,
                13,
                null
              ],
              "degrees": [
                null,
                "5",
                "1",
                "b3",
                "b7",
                null
              ],
              "aboveText": "",
              "voicingDegree": "2ª Inversión",
              "anchorFret": 12
            }
          ]
        }
      ],
      "fillToEdge": true
    },
    {
      "id": "m-major-s2-r3-2",
      "label": "Ruta 3 · V",
      "chordEvents": [
        {
          "id": "e-major-s2-r3-2",
          "chordName": "G7",
          "family": "dominant",
          "voicings": [
            {
              "id": "v-major-s2-r3-2",
              "frets": [
                null,
                10,
                12,
                10,
                12,
                null
              ],
              "degrees": [
                null,
                "1",
                "5",
                "b7",
                "3",
                null
              ],
              "aboveText": "",
              "voicingDegree": "Fundamental",
              "anchorFret": 12
            }
          ]
        }
      ],
      "fillToEdge": true
    },
    {
      "id": "m-major-s2-r3-3",
      "label": "Ruta 3 · I",
      "chordEvents": [
        {
          "id": "e-major-s2-r3-3",
          "chordName": "Cmaj7",
          "family": "major",
          "voicings": [
            {
              "id": "v-major-s2-r3-3",
              "frets": [
                null,
                10,
                10,
                9,
                12,
                null
              ],
              "degrees": [
                null,
                "5",
                "1",
                "3",
                "7",
                null
              ],
              "aboveText": "",
              "voicingDegree": "2ª Inversión",
              "anchorFret": 12
            }
          ]
        }
      ],
      "fillToEdge": true
    },
    {
      "id": "m-major-s2-r4-1",
      "label": "Ruta 4 · ii",
      "chordEvents": [
        {
          "id": "e-major-s2-r4-1",
          "chordName": "Dm7",
          "family": "minor",
          "voicings": [
            {
              "id": "v-major-s2-r4-1",
              "frets": [
                null,
                15,
                15,
                14,
                15,
                null
              ],
              "degrees": [
                null,
                "b7",
                "b3",
                "5",
                "1",
                null
              ],
              "aboveText": "",
              "voicingDegree": "3ª Inversión",
              "anchorFret": 15
            }
          ]
        }
      ],
      "fillToEdge": true
    },
    {
      "id": "m-major-s2-r4-2",
      "label": "Ruta 4 · V",
      "chordEvents": [
        {
          "id": "e-major-s2-r4-2",
          "chordName": "G7",
          "family": "dominant",
          "voicings": [
            {
              "id": "v-major-s2-r4-2",
              "frets": [
                null,
                14,
                15,
                12,
                15,
                null
              ],
              "degrees": [
                null,
                "3",
                "b7",
                "1",
                "5",
                null
              ],
              "aboveText": "",
              "voicingDegree": "1ª Inversión",
              "anchorFret": 15
            }
          ]
        }
      ],
      "fillToEdge": true
    },
    {
      "id": "m-major-s2-r4-3",
      "label": "Ruta 4 · I",
      "chordEvents": [
        {
          "id": "e-major-s2-r4-3",
          "chordName": "Cmaj7",
          "family": "major",
          "voicings": [
            {
              "id": "v-major-s2-r4-3",
              "frets": [
                null,
                14,
                14,
                12,
                13,
                null
              ],
              "degrees": [
                null,
                "7",
                "3",
                "5",
                "1",
                null
              ],
              "aboveText": "",
              "voicingDegree": "3ª Inversión",
              "anchorFret": 15
            }
          ]
        }
      ],
      "fillToEdge": true
    }
  ],
  "structure": {
    "repeats": [],
    "endings": [],
    "markers": [],
    "jumps": []
  }
}
